query,business_name,review_rating,review_text,review_photos,datetime_utc,timestamp,review_id,author_title,author_friend_count,author_photo_count,author_reviews_count,author_location,author_image,author_id,author_url,owner_reply,owner_reply_title,owner_reply_datetime_utc,owner_reply_timestamp,next_page_cursor,review_tags_helpful,review_tags_thanks,review_tags_love_this,review_tags_oh_no
https://www.yelp.com/biz/huntington-beach-huntington-beach,Huntington Beach,4,I always come to this beach with my family! We don't like staying next to the pier cause it's to crowded. I did go with my friends close to the pier and it was a bit crowded. Someone told me this place is rocky didn't believe it till my next visit it sure is. The waves are more dangerous in California then Florida. The water is super cold in California. This time I saw a sea lion come close to me & my brother & I got scared so I got out of the water. I heard if a sea lion is coming this close to shore that means it's running from something and I did see some finns after it. In 2017 it did report that more sharks were coming close to shore in California. Pretty scary.,"https://s3-media0.fl.yelpcdn.com/bphoto/iNHZ8O5mw56e7ffE-B8v7w/348s.jpg, https://s3-media0.fl.yelpcdn.com/bphoto/1loeQKq82vJSxM7adYm2gw/348s.jpg, https://s3-media0.fl.yelpcdn.com/bphoto/lycJvgKtOzHd82Lb-AgL_g/348s.jpg",02/16/2018 16:20:00,1518798000,tGzhb9tfhLXH-14lwAFzpQ,Dolores D.,722,13942,1498,"Phoenix, AZ",https://s3-media0.fl.yelpcdn.com/photo/tcqLBuB2x1oWQ_DNIwqfyw/180s.jpg,7C4B2Skmh4X9f8xJDo9O4w,https://www.yelp.com/user_details?userid=7C4B2Skmh4X9f8xJDo9O4w,,,,,,0,0,0,0
https://www.yelp.com/biz/huntington-beach-huntington-beach,Huntington Beach,5,Ashley was super personal very attentive and made us feel like we were at home... she makes me want to go to Fred s again,,06/07/2022 04:02:56,1654574576,tHHD1x-5Tbk6Kf9cSOUakQ,Cary W.,0,0,17,"Huntington Beach, CA",,wW6KESS7ASJKvfeVt59yGg,https://www.yelp.com/user_details?userid=wW6KESS7ASJKvfeVt59yGg,,,,,,0,0,0,0
https://www.yelp.com/biz/huntington-beach-huntington-beach,Huntington Beach,5,"We try and make it annually, we have friends who live right up from the beach.  Each summer we travel down to Kern County for visits with close friends, then just jump on down to the beach via John Wayne airport.
LOVE LOVE LOVE this beach, and love the shopping we do at the Pier as well.  Visually stunning, so WORTH the drive up and along the coast to take in ALL the sights.  We just REALLY enjoy this trip, and look forward to our August return! See you soon!",https://s3-media0.fl.yelpcdn.com/bphoto/lwJ-C0UvUiv2QfDRkMJm9w/348s.jpg,03/12/2018 22:29:25,1520893765,3WJ2KbD8COwtIVLyOL-Riw,Kim H.,311,576,354,"Rocklin, CA",https://s3-media0.fl.yelpcdn.com/photo/U-DFo3kTxjEBiICHvtGJ2g/180s.jpg,uKz6lS-eIi94-Y-Jlwc8hw,https://www.yelp.com/user_details?userid=uKz6lS-eIi94-Y-Jlwc8hw,,,,,,0,0,0,0
https://www.yelp.com/biz/huntington-beach-huntington-beach,Huntington Beach,5,"A MUST DO!  It's known for it's Beautiful Beach & Large Waves & Clear Water. Huntington is also known for its Spectacular Sunsets & if you're lucky enough you might catch their equally Spectacular Moon Risings. What's a moon rising - when the sun is still out but the moon is seen hanging in the sky in daylight. AWESOME!!!
It's great to walk along the beach from 1 end of the beach to the other end. The Over 1 & 1/2 hour walk is beautiful & with a set of headphones & music the time goes by very quickly. Before you know it you've passed the pier and are at 1 end & getting ready to head back in the other direction. This is great for beach goers but especially those who hate to exercise; the scenery makes it easy to do!  
This spot is very popular for Boogie boarders, surfers, kite surfers, & volleyball players & swimmers. This beach has wide white sandy beaches & a separate large path for  bikes, roller skaters, skateboarders & surreys. They even have Fire Pits but you got to get there very early. Parking is $15 but there are meters on the street also.  You can bring your own cooler or there are lots of places to eat across from The Pier & the adjacent Pacific City 
It used to be, you had to have mega bucks & be really rich to have the Good Life, not anymore. The Game has changed. You've been Upgraded. Now You Can 
Live Like a King on a Limited Budget!","https://s3-media0.fl.yelpcdn.com/bphoto/hqXVw-tiNPmGKdsUltVeDA/348s.jpg, https://s3-media0.fl.yelpcdn.com/bphoto/f6tUmhF2VGNdZAkXkS2kUg/348s.jpg, https://s3-media0.fl.yelpcdn.com/bphoto/nHf5Rkht2MvzWFSH4uSUIA/348s.jpg, https://s3-media0.fl.yelpcdn.com/bphoto/IymbCLDgIsOgoAOjHF07Sg/348s.jpg, https://s3-media0.fl.yelpcdn.com/bphoto/Pn2UI_UPpVqvevaZ3Dv75g/348s.jpg, https://s3-media0.fl.yelpcdn.com/bphoto/oFfkamGELBhd3UWyilngBA/348s.jpg, https://s3-media0.fl.yelpcdn.com/bphoto/98T2C2q_VgRIrVOODMRg1Q/348s.jpg, https://s3-media0.fl.yelpcdn.com/bphoto/1r1KIUp1fbCZ9HHOO01EpA/348s.jpg, https://s3-media0.fl.yelpcdn.com/bphoto/XMBV5ostbyp5Mc2zPjPVqA/348s.jpg, https://s3-media0.fl.yelpcdn.com/bphoto/IKWBp3ZaXNNhm7SE1Xndpw/348s.jpg",10/27/2017 20:28:48,1509136128,GfNdCVE5ba0zP7LVUWjuiw,Stephen Z.,172,61771,848,"Studio City, CA",https://s3-media0.fl.yelpcdn.com/photo/DpTPVKmekY35n4bQlnlVUw/180s.jpg,MOkmNNsJLDOebJ-YW1xDmQ,https://www.yelp.com/user_details?userid=MOkmNNsJLDOebJ-YW1xDmQ,,,,,,0,0,0,0
https://www.yelp.com/biz/huntington-beach-huntington-beach,Huntington Beach,5,"Had the pleasure of catching some California sun after returning from a cruise. We happen to stumble upon a surfing competition. It was a really cool expereince. Lot of vendors and you cool vibe. Beach was really clean. The bathrooms were kinda creepy but they were clean. The sink to wash your hands are located on the side of the bayhroom. Plenty of Vollyball nets, places to eat, and get a surfing lesson. I can't wait to go back in a few months!",,03/24/2019 19:23:49,1553455429,ty4zzkEqz17969VqR92xRg,Miya J.,25,629,299,"Aurora, CO",https://s3-media0.fl.yelpcdn.com/photo/slDI6k0l56jVv7PvBqhidA/180s.jpg,QXY6XLhwuyxRiLGwKMQh_g,https://www.yelp.com/user_details?userid=QXY6XLhwuyxRiLGwKMQh_g,,,,,,1,0,3,0
https://www.yelp.com/biz/huntington-beach-huntington-beach,Huntington Beach,5,"Well it went from hailing in the morning to this beautiful sunset at Huntington Beach Pier today. The sound & smell of the ocean to the smell of the fire pits, friendly people, people walking their dogs, as so am I. I just came to walk and get some fresh air little did I know I would be treated to such an amazing sunset. Photos taken with my Google Pixel 3XL. Huntington Beach my happy place. Oh and as I mentioned it hailed this morning I was at the beach in shorts & no hoodie!","https://s3-media0.fl.yelpcdn.com/bphoto/GVNJhbpHYhUmqePMPrbYWQ/348s.jpg, https://s3-media0.fl.yelpcdn.com/bphoto/61AwZFruyZ6r8pJaaGlyMQ/348s.jpg, https://s3-media0.fl.yelpcdn.com/bphoto/JhaA2vYC4DPN9KLT0IFt5g/348s.jpg, https://s3-media0.fl.yelpcdn.com/bphoto/h-aZuGWmHS4ylS3WJPODaQ/348s.jpg, https://s3-media0.fl.yelpcdn.com/bphoto/y480tz4LuO9J8Ctwun9l8g/348s.jpg, https://s3-media0.fl.yelpcdn.com/bphoto/srwii8OXuowElpRT5BU5Cw/348s.jpg, https://s3-media0.fl.yelpcdn.com/bphoto/83-DPGFQEbCKEuAKinJOpA/348s.jpg, https://s3-media0.fl.yelpcdn.com/bphoto/argCOHvIVvR7MeUZXGL5mg/348s.jpg, https://s3-media0.fl.yelpcdn.com/bphoto/RQ-2g9CUZ1PQwSX-33tbTg/348s.jpg, https://s3-media0.fl.yelpcdn.com/bphoto/wLxqyBqu2d9JW4OHYabXcQ/348s.jpg",11/05/2019 16:04:59,1572969899,WugfOhPrnDdLPMza_xeb_Q,Yolanda G.,0,30,13,"Westminster, CA",https://s3-media0.fl.yelpcdn.com/photo/NLOs6ztcAnc17dlB9_5Vuw/180s.jpg,4U_LgBmQIBDsnojIdL8y4Q,https://www.yelp.com/user_details?userid=4U_LgBmQIBDsnojIdL8y4Q,,,,,,0,0,1,0
https://www.yelp.com/biz/huntington-beach-huntington-beach,Huntington Beach,4,"The Beach belongs to everyone. I also agree with those who want to keep portions of California's beaches private. Inlanders who act like it's their first time at the beach. Kooks in the water. Folks who cannot distinguish between pedestrian and the bike lane. Breakers leaving empty beer cans, liquor bottles, cigarettes, trash. You make the experience less memorable. STAY THE F*CK HOME!",,07/05/2018 07:01:23,1530774083,W-Mm4u4m9GNrsHt569RSfw,Brian Y.,4992,10022,361,"South Bay, CA",https://s3-media0.fl.yelpcdn.com/photo/KLcZVUUtgsmkBUqNIWRyYQ/180s.jpg,cRMOfdX1CEp8H3b225SgAA,https://www.yelp.com/user_details?userid=cRMOfdX1CEp8H3b225SgAA,,,,,eyJ2ZXJzaW9uIjoxLCJ0eXBlIjoib2Zmc2V0Iiwib2Zmc2V0Ijo5OX0,44,2,59,1
https://www.yelp.com/biz/huntington-beach-huntington-beach,Huntington Beach,5,"Surf's up this week!
Each wave with it's own exotic design.
The smell of Coppertone in the air..
People everywhere...
Some good.. some not so good...
Some tan, some burnt
Some beyond burnt...
Aroma of BBQ steaks and hot dogs.
A stroll along the beach...
Bicycles, joggers, taxi carts flood the beach

It's the suf's championship week.
Huntington Beach you have changed so dramatically for the better.
First class hotels with a walkway over PCH...
Restaurants galore.... so many to choose from.
When I was a kid...ain't nothing was around.  
We just packed a lunch in an ice chest with sodas and headed for the beach with ma and pa.","https://s3-media0.fl.yelpcdn.com/bphoto/PbzKPXnobpKb83GqJ7uo9g/348s.jpg, https://s3-media0.fl.yelpcdn.com/bphoto/kHBSbXWp6KeYYL7wwVjCQA/348s.jpg, https://s3-media0.fl.yelpcdn.com/bphoto/7iG4rsUqgHIbSYf-98awSg/348s.jpg, https://s3-media0.fl.yelpcdn.com/bphoto/D7ecXvA3Ju0suhv37smyOA/348s.jpg, https://s3-media0.fl.yelpcdn.com/bphoto/UR-UGLvDqJUtnFpUX5cYuQ/348s.jpg, https://s3-media0.fl.yelpcdn.com/bphoto/2UBY5SmPrygVYSd2s381cA/348s.jpg, https://s3-media0.fl.yelpcdn.com/bphoto/8_wdPpJrjUxj25ZooOJHWA/348s.jpg, https://s3-media0.fl.yelpcdn.com/bphoto/jcUuvyyjRUtYoassH4S1uQ/348s.jpg",08/01/2010 06:59:11,1280645951,fd77JAO9JzuBk1iAGObaHw,Ron L.,4969,7212,1654,"Oahu, HI",https://s3-media0.fl.yelpcdn.com/photo/j-Gx96EcCy6l85XpsPchZg/180s.jpg,cjotiAHFSbFuvbxTWmGi1Q,https://www.yelp.com/user_details?userid=cjotiAHFSbFuvbxTWmGi1Q,,,,,,24,0,28,0
https://www.yelp.com/biz/huntington-beach-huntington-beach,Huntington Beach,4,"One of the better beaches around the LA/OC area. To be more specific, I would say this is one of the better beaches in the LA area.

During the summertime, parking is around $15. You would think with that kind of money, they would maintenance the damn bathrooms located next to Jack's Concession Stand. The bathrooms there....I've never seen it this bad until my recent July 2014 trip. And I've been coming to this beach since the early 2000. One stall had feces all over the toilet seat, another had an old rolled up bikini bottom and one had urine sprayed all over the seat. I kid you not, I cannot make this stuff up. WTF is going on Huntington Beach!?!! Get your ishh straighten'd up!!!  I can't believe how disgusting and inconsiderate some human beings can be. My goodness.

Even though the bathrooms are a complete nightmare, the water and the sand area are still very clean. I didn't see any trash laying around. Everyone seemed to pretty much pick up after themselves (as it should be.). As long as it's clean....I will continue to come to this beach.

Plus on Main St, they have plenty of restaurants and shops there. Perfect for a full day at the beach.",https://s3-media0.fl.yelpcdn.com/bphoto/-ia57KWgTp_rVdVkXtiR4Q/348s.jpg,07/28/2014 05:35:22,1406525722,W2lLVqy0x5t858Odu4-wBQ,Cynthia L.,249,1134,865,"Las Vegas, NV",https://s3-media0.fl.yelpcdn.com/photo/diVYPRz6OeViJ5WVaLpQMA/180s.jpg,9ks-80ZxeCZWNObzEbW4-Q,https://www.yelp.com/user_details?userid=9ks-80ZxeCZWNObzEbW4-Q,,,,,,7,0,3,0
https://www.yelp.com/biz/huntington-beach-huntington-beach,Huntington Beach,1,The Sonic in Huntington Beach Needs Management to take Action. I Love the Lemonade slushies and go 3x / wk on Avg. and No Matter what time I go they have the stalls closed requiring Everyone to Have to Use the Drive thru which honestly for a Drink is Crazy the Amount of Time it takes to get thru their line. Hire More Employees or figure out something Bc it's Ashame to Like a plc this Much but to be let down Everytime due to the wait. It's A fast food Establishment. 30 Min for a drink is Out of Control!,,10/19/2021 22:33:27,1634682807,laVfwYuxmQYBtMIBfoW1PQ,Shanda C.,0,0,7,"Huntington Beach, CA",,FpeO-F_MN8iqyi5rv8DHqQ,https://www.yelp.com/user_details?userid=FpeO-F_MN8iqyi5rv8DHqQ,,,,,,1,0,1,0
https://www.yelp.com/biz/huntington-beach-huntington-beach,Huntington Beach,4,We were here for our friend's proposal! They have this really nice area with pretty rocks looking out towards the beach. Pretty for pictures!!! The beach itself is also pretty clean so that's a bonus. They have bike riding area which is cute and romantic. I'll have to come back on my own time and explore a little more. The parking is $15 though which is guess is pretty standard at most beaches. Just make sure you go early so you can spend a lot of time at the there to make it worth it.,"https://s3-media0.fl.yelpcdn.com/bphoto/hhctMOIgLEZWi5IYuXrQnA/348s.jpg, https://s3-media0.fl.yelpcdn.com/bphoto/RXoghBs87atr95h9CHwZgA/348s.jpg",09/04/2017 18:13:41,1504548821,ixnD6GptFVsOXTdAEgrnLg,Thuy N.,117,1263,245,"Huntington Beach, CA",https://s3-media0.fl.yelpcdn.com/photo/5EC_hzB2WKCcSr6gkBGZ3w/180s.jpg,4Op0p49yVk5Z-1a9GOHQRw,https://www.yelp.com/user_details?userid=4Op0p49yVk5Z-1a9GOHQRw,,,,,,0,0,0,0
https://www.yelp.com/biz/huntington-beach-huntington-beach,Huntington Beach,5,"I bought a car this past weekend with sales rep Sandra and Kevin, they are both great! Kevin answered all my questions and was very attentive. They were both patient with me as I made my decision on which car to buy. Great experience and I'm loving my RAV4!",,03/19/2022 01:13:47,1647652427,oRRbeWFrsZJzV4NQa3DuDQ,Brigette Q.,0,0,1,"El Monte, CA",,DGqQx6u3QbVBoVTM0aB4qA,https://www.yelp.com/user_details?userid=DGqQx6u3QbVBoVTM0aB4qA,,,,,,0,0,0,0
https://www.yelp.com/biz/huntington-beach-huntington-beach,Huntington Beach,5,"- Locale Destination - 
It's on PCH and Main St in Huntington Beach. 

Huntington beach is a lot bigger than its nearby beaches. I like this beach best because it's so easy and convenient (a less hasstle) to do anything unlike nearby beaches - easy to find a parking spot, you can do all kinds of activities here, and laid back and very ""California beach"" atmosphere.

Parking: You can find a spot (free!) in residential area, though you might need to walk a few blocks during the summer time and on weekends. Lots of meter parking along PCH. City parking by the beach is $15 for the day. The annual parking pass for $200. It's way easier to find a spot than ""Newport Beach"" and other beaches in the south. 

Surf: Yes. Very territorial locals, so be careful. 
Bike lane: Yes. Good beach biking ;)
Beach volley coats: Lots 
Bathroom: Yes
Showers: Yes
Surfing lesson: Yes (over 5 yrs old)
Rental bikes: Yes
Scuba: No. The water isn't so clear for diving. 
Sea creatures: Dolphins sometimes.
Eateries on beach: Quick grab to ""Duke's"". 
Events: Lots - US Open (surfing), X-games, July 4th etc. I like their farmer's market on Main St - every Tuesday evening - fresh produce, restaurants, art & craft etc. 
Pier: You can eat at ""Ruby's"" (at the end of pier). 

Main St: Lots of surf shops, ice cream, big chain restaurants (some small ones), clothing stores, souvenier shops, and cafe. Most foods aren't good here (Welcome to HB ;p - except for ""North Shore Poke Co"" and ""La Rocco's Pizzeria"". Both of them are located OFF Main St!!).  




- Conqueror's Deduction - 
This is one of my favorite beaches in OC. You do feel ""California""!!
I love this beach and come here so often - just to chill, take pictures, surf etc. It's one of the perks to live in California ;) 

This is one of the beaches you must visit when you're in CA.","https://s3-media0.fl.yelpcdn.com/bphoto/SD_LtkMnWaV8DVho_oe5Dw/348s.jpg, https://s3-media0.fl.yelpcdn.com/bphoto/_5x50L463RTzGbo279oC4w/348s.jpg, https://s3-media0.fl.yelpcdn.com/bphoto/dt53uHSbJ6_eS09WhFc3PQ/348s.jpg, https://s3-media0.fl.yelpcdn.com/bphoto/2TyuO194P4UwgGJbO-xLNg/348s.jpg, https://s3-media0.fl.yelpcdn.com/bphoto/8kvhOWc2MEQOEljb5YeH4A/348s.jpg, https://s3-media0.fl.yelpcdn.com/bphoto/B8_tTYd8izp7Kfta2cF-NA/348s.jpg, https://s3-media0.fl.yelpcdn.com/bphoto/Vp3mOhpOH-Sf_wrc-dwffg/348s.jpg, https://s3-media0.fl.yelpcdn.com/bphoto/W2a7ECsemsxHMV37jLdwhA/348s.jpg, https://s3-media0.fl.yelpcdn.com/bphoto/ynphp3horoUJH-rc0BkZSA/348s.jpg, https://s3-media0.fl.yelpcdn.com/bphoto/4AzYkT1m0A7EVRjM7scoCw/348s.jpg",05/04/2014 12:26:56,1399206416,uinHbHdkYi0uihbKcM-HUQ,Akiko I.,1444,16833,1739,"Marina del Rey, CA",https://s3-media0.fl.yelpcdn.com/photo/LwxlFWtWeM6QIQ0SHr7Rbw/180s.jpg,RQT9QoVcQd9gnKhayD5cUw,https://www.yelp.com/user_details?userid=RQT9QoVcQd9gnKhayD5cUw,,,,,,8,0,8,0
https://www.yelp.com/biz/huntington-beach-huntington-beach,Huntington Beach,5,"*Tourist Approved 

I've been coming to California almost every week for a year and my goal was to see the Pacific Ocean. Finally! I finally stuck my foot in the Cali water three weeks ago (end of May 2017). 

I had the best time here. We went to Fred's across the street. The group had enchiladas and I had some guacamole, chips and a Heineken. After that, it was la playa. Youth Surf Competition was on deck, families, singles, adults, kids, everyone having fun from boogie boarding or volleyball. 

Then, I found my tribe. I wasn't looking for it but there they were. I'm from the East so this was a huge treat for me to look over and see a group forming and hitting djembes and all types of drums. I jumped right in. One of the players (Juan) had two extra drum instruments and he said I could play them so I spent three hours switching between the two drums playing with these great people. From boardwalk dancers to hoola hooping everyone was getting in on this musical interaction. The one local guy said they do this every Sunday. Bystanders were cheering and clapping. It was really nice to find this 3,000 miles away from home. A group of 30-50 fellow drummers. It was majestic.","https://s3-media0.fl.yelpcdn.com/bphoto/5u-9duuw4lmvKx9JA9FDYw/348s.jpg, https://s3-media0.fl.yelpcdn.com/bphoto/iB8BkqPMJtXTftw1tdqGEw/348s.jpg, https://s3-media0.fl.yelpcdn.com/bphoto/5ucNiBxgylq2OQ0gOmLTFw/348s.jpg",06/13/2017 02:18:09,1497320289,eQgn6OMgMuM9rlFfiabUOQ,Keri O.,46,612,178,"Greenville, SC",https://s3-media0.fl.yelpcdn.com/photo/afgTIdgfQGSShnv3ArBbMA/180s.jpg,_QPoL66NPjVVwymAW8sVLQ,https://www.yelp.com/user_details?userid=_QPoL66NPjVVwymAW8sVLQ,,,,,,0,0,1,0
https://www.yelp.com/biz/huntington-beach-huntington-beach,Huntington Beach,5,"The best beach in Orange County! 

I have been coming here since I was a kid. In grade school we would take the bus down Beach Blvd. with our boards. I still come here. My favorite spots are the North side of the pier and over by Lifeguard Tower 8. Even if there are no waves, you can almost always find a decent place to body surf between this stretch. 

People here are generally nice on the sand. Just to the north of the pier are where most of the high school and college kids go. It is pretty fun during the summer. But, it can get annoying if there are people in the water that should not be surfing. If you walk two lifeguard towers further North, it is more suitable for families and children. 

The South-side of the pier seems like an endless stretch of sand. It is great for taking long walks to think and meditate and great for running. 

Hawaii does have great beaches and surf. Cancun has awesome sand and water. But, I do not live anywhere near them and this place is always easily accessible. 

I have to say that watching the sunset here during Summer is 5 stars all on its own! 

Well, tomorrow is the 4th. I can tell you a story or two but will refrain. 
Just be prepared for a crowd at the beach if you are here for the 4th of July and an absolute party on the streets. I actually kind of stay away from here on the 4th, as the crowd has a lot of people from other places. Especially in the water I see people swimming with jeans and belts on. Isn't this dangerous? Maybe they even where shoes. I never understood the concept of wearing jeans in the ocean. There are these things called trunks.

Parking is easy. PCH is lined with meters and you can park for a fee by the pier. There is also a great deal of parking on the side streets. 

Newport is nice, but I still prefer HB for the above reasons. There are nice pictures on this board so take a moment to see yourself!",,07/03/2009 14:46:20,1246632380,gXqrS0N98kBua_7dn942CQ,Nick H.,1157,8543,2685,"Newport Beach, CA",https://s3-media0.fl.yelpcdn.com/photo/WSp5AXqQtEd4-Dm3FD452w/180s.jpg,f-iREBx-5CznQjIMWmoOkw,https://www.yelp.com/user_details?userid=f-iREBx-5CznQjIMWmoOkw,,,,,,6,0,8,0
https://www.yelp.com/biz/huntington-beach-huntington-beach,Huntington Beach,3,"Although, Huntington Beach is a beautiful place to go, it is usually crowded and the only parking spots where vehicles aren't parked at are usually these reserved parking spots and to be honest, the parking issues there since there are little to no parking spots that are opened for non reserved people and whenever someone is trying to park their SUV, it makes it much more challenging for people with a big vehicle to park in a parking spot since there are other vehicles parked between these parking spaces and on Sunday's, it is much worse because it makes it even more of a challenge to get in, especially for someone with a big vehicle like a Chevrolet Suburban or something like that",,09/07/2020 01:03:17,1599440597,ieervD2Gx-4PZUJIgikUIg,Omar Z.,28,8,33,"Arroyo Grande, CA",https://s3-media0.fl.yelpcdn.com/photo/YPcm55NHKMbTvc_X6hg6QQ/180s.jpg,1kgPTmtWrcvwwPJnyKVPuA,https://www.yelp.com/user_details?userid=1kgPTmtWrcvwwPJnyKVPuA,,,,,,2,0,0,0
https://www.yelp.com/biz/huntington-beach-huntington-beach,Huntington Beach,3,"I won't be back here for a LOOOOONG time.  Never say never, but I'd rather not come back if I have any control over it.

Apparently, there was some corporate party that did the d-bag move of reserving most of the parking at the beach.  As I was driving around to find any sort of parking around the area, I look at the reserved lots and saw that they were empty.  Maybe a handful of cars were in a lot where hundreds of cars could have parked.  This alone actually ended up leading to me making the decision to skip out on my friend's bonfire.  And it wasn't worth the $15 parking fee when they told me this past 7pm.

I'll still give it 3 stars because it's a nice beach.  I just can't recommend it to friends since what I recently experienced is actually possible.",,07/22/2016 00:58:07,1469149087,sBPhtMZfo9Xl9didEbLGuw,Wilson A.,372,1183,983,"Monrovia, CA",https://s3-media0.fl.yelpcdn.com/photo/-imBHAMNcQ_ybj5ZNjnsUw/180s.jpg,1tenbBbCUONAtbC0k5rdmw,https://www.yelp.com/user_details?userid=1tenbBbCUONAtbC0k5rdmw,,,,,eyJ2ZXJzaW9uIjoxLCJ0eXBlIjoib2Zmc2V0Iiwib2Zmc2V0IjoxMDl9,4,0,0,0
https://www.yelp.com/biz/huntington-beach-huntington-beach,Huntington Beach,4,"I had my kids bday party today. Off of PCH, pass Brookhurst, & turn left at Magnolia. It was $15 to park and we parked right by bathroom, cafe, and bike rental place. We setup between Lifeguard towers 7 & 8. It worked well because it wasn't too far from our car and there's a partial sidewalk before stepping into deep sand. It was a great spot for an 8th year olds Mermaid Birthday Bash.","https://s3-media0.fl.yelpcdn.com/bphoto/eN83XxZlKElDyP1mdUHngg/348s.jpg, https://s3-media0.fl.yelpcdn.com/bphoto/QKQJVaEvDioPZsa2z8NV2Q/348s.jpg",08/04/2018 04:18:17,1533356297,G1GVUmlfo9Nj7N4mHrdyMQ,Sherri C.,0,77,84,"Ontario, CA",https://s3-media0.fl.yelpcdn.com/photo/pvlkVYEi9yaKbVLJ3v5bZw/180s.jpg,5A55HjFQhNetOPFm7FhQSQ,https://www.yelp.com/user_details?userid=5A55HjFQhNetOPFm7FhQSQ,,,,,,2,0,1,0
https://www.yelp.com/biz/huntington-beach-huntington-beach,Huntington Beach,1,We are in the middle of a pandemic and hardly anyone wears a face mask or practicing social distancing.  Bars are open with people sitting shoulder to shoulder.  Quite scary.,,06/02/2020 00:09:31,1591056571,DHblIic7E_HRdnZw43g2wg,Trang N.,21,157,178,"CA, CA",https://s3-media0.fl.yelpcdn.com/photo/ktv-4Kgl4Rh4KrOLpSmTOw/180s.jpg,KyjHmA_9rDrCpGrzcp4h5A,https://www.yelp.com/user_details?userid=KyjHmA_9rDrCpGrzcp4h5A,,,,,,4,0,3,0
https://www.yelp.com/biz/huntington-beach-huntington-beach,Huntington Beach,5,Our favorite beach in so cal. Always clean and beautiful. As for the people though be advised that most of them don't seem to be of the mask wearing mindset (even though we're dealing with one of the worst pandemic's ever).,,11/08/2020 06:48:02,1604818082,2lPgtqCAtOarVcfUuWSbkQ,Matt Y.,1,4,61,"Montebello, CA",https://s3-media0.fl.yelpcdn.com/photo/sSsONpUhozlO64r2C5jvwQ/180s.jpg,YiFXMl64HM3kzI3IO2oApA,https://www.yelp.com/user_details?userid=YiFXMl64HM3kzI3IO2oApA,,,,,,0,0,1,0
